{
  "plan_version": 2,
  "iteration": 1,
  "request_id": "508b8258a96b4adc89fcc0462b664058",
  "ledger_entry": {
    "evaluation_summary": "",
    "direction": "",
    "readonly_files": [],
    "case_analysis": [
      {
        "case_id": "level3/fused_patch_concat_layernorm_19",
        "observation": "",
        "explanation": "",
        "evidence": "",
        "next_action": ""
      },
      {
        "case_id": "level3/fused_patch_concat_layernorm_21",
        "observation": "",
        "explanation": "",
        "evidence": "",
        "next_action": ""
      },
      {
        "case_id": "level3/fused_patch_concat_layernorm_1",
        "observation": "",
        "explanation": "",
        "evidence": "",
        "next_action": ""
      },
      {
        "case_id": "level3/fused_patch_concat_layernorm_20",
        "observation": "",
        "explanation": "",
        "evidence": "",
        "next_action": ""
      },
      {
        "case_id": "level3/fused_patch_concat_layernorm_3",
        "observation": "",
        "explanation": "",
        "evidence": "",
        "next_action": ""
      },
      {
        "case_id": "level3/fused_patch_concat_layernorm_10",
        "observation": "",
        "explanation": "",
        "evidence": "",
        "next_action": ""
      }
    ]
  },
  "suggest_next": [
    {
      "task_id": "T1",
      "priority": "P1",
      "task_type": "modify",
      "action": "",
      "reason": "",
      "case_scope": "cases",
      "target_cases": [
        "level3/fused_patch_concat_layernorm_19"
      ],
      "operator_reason": "",
      "case_bindings": [
        {
          "case_id": "level3/fused_patch_concat_layernorm_19",
          "implementation_files": [
            ""
          ],
          "route_evidence": [
            {
              "file": "",
              "location": "",
              "explanation": ""
            }
          ]
        }
      ],
      "changes": [
        {
          "file": "",
          "operation": "modify",
          "location": "",
          "method": ""
        }
      ],
      "acceptance_checks": [
        ""
      ]
    }
  ]
}